org,title,url,description,thumbnail,order,category,tags
Harvard,Monitoreo de COVID-19 en Puerto Rico,https://rconnect.dfci.harvard.edu/covidpr/,This tool provides a detailed summary of the COVID-19 cases in Puerto Rico provided by the PR Department of Health.,rconnect.dfci.harvard.edu_covidpr_.png,,public health,"spanish, covid-19"
Philippe De Brouwer (personal),Covid-19 Dashboard,http://www.de-brouwer.com/about/covid.html,"This app generates a comparison analysis on COVID-19 by country, stages of infection, and mortality rates with data from John Hopkins University.",phdb.shinyapps.io_covid_.png,,public health,"covid-19, forecast, report, map, table, SIR Model"
California Department of Public Health,Opioid Overdose Survey,https://skylab.cdph.ca.gov/ODdash/,"This app provides data on state and local level drug-related overdose outcomes for California, including deaths, emergency department visits, and hospitalizations, as well as opioid and select other drug prescription data.",skylab.cdph.ca.gov_communityBurden_.png,,public health,"opoid, overdose, surveillance, california, state, county,"
California Department of Public Health,CCB (Disease and Cost Engine),https://skylab.cdph.ca.gov/communityBurden/#tab-2190-1,"A tool that can explore data on burden of disease in multiple levels of geographic granularity in order to answer and generate questions, both simple and complex, about the intersection between health disparities and place.",skylab.cdph.ca.gov_ODdash_.png,4,public health,"map, trend, social determinants of health"
Epicentre,Covid-19 EPI Dashboard,https://reports.msf.net/public/covid19/,"This app provide a global epidemiological overview of the COVID-19 pandemic, incorporating data from multiple sources.",reports.msf.net_public_covid19_.png,,public health,"epidemiology, covid-19, map, trend, msf"
Regeneron,COVID-19 Dashboard,https://covid19dashboard.regeneron.com/?tab=Home&subTab=Europe,An app that tracks COVID-19 genomic mutations by country and historical data.,covid19dashboard.regeneron.com_content_1__tab=Home.png,,informatics,"covid-19, bioinformatics, map"
Mathematica,COVID-19 Risk Score Calculator,https://19andme.covid19.mathematica.org,This app synthesizes reported COVID-19 geographic case data and rapidly evolving scientific research to help you ballpark how much risk this disease poses to you.,19andme.covid19.mathematica.org_.png,1,medicine,"covid-19, risk calculator"
National Cancer Institute,Colorectal Cancer Cure Probability Calculator,https://appshare.cancer.gov/connect/,This app estimates the probability that a patient with colorectal cancer is cured of their cancer.,appshare.cancer.gov_connect_.png,,medicine,"risk calculator, cancer"
California Department of Public Health,California Communicable Diseases Assessment Tool,https://calcat.covid19.ca.gov/cacovidmodels/,"An app that provides ensemble estimates of critical COVID-19 and influenza metrics from a variety of models, the site facilitates comparison, dialogue, and clarity around trends in the COVID-19 pandemic and across broader infectious disease surveillance.",calcat.covid19.ca.gov_cacovidmodels.png,,public health,"covid-19, influenza, forecast, state, county, region"
New Zealand Institute of Environmental Science and Research,ESR Wastewater Surveillance,https://poops.nz/,An app used to track COVID-19 risk in local areas by testing wastewater samples for the presence of SARS-CoV-2.,poops.nz_.png,,public health,"covid-19, surveillance"
Mayo Clinic ,Milestone Prediction Tool,https://rtools.mayo.edu/a_milestone_prediction/,An app used to predict a milestone time (time to a specific number of events) for clinical trial monitoring.,rtools.mayo.edu_a_milestone_prediction_.png,,pharma,"clinical trial, bayesian"
Mayo Clinic ,Dutch-American Risk Stratification Tool,https://rtools.mayo.edu/DART/,The Dutch-American Risk stratification Tool (DART‐1) to calculate the probability (%) of IPMNs without worrisome features or high‐risk stigmata at diagnosis to progress and fulfill resection criteria according the 2012 International Fukuoka guidelines.,rtools.mayo.edu_DART_.png,,medicine,"risk calculator, cancer"
Mayo Clinic ,DxStat,https://rtools.mayo.edu/diagnostic_test_calculator/,An app that can be used for both confidence interval estimation and sample size estimation in diagnostic testing studies.,rtools.mayo.edu_diagnostic_test_calculator_.png,,medicine,"sample size, confidence interval estimation"
Mayo Clinic ,Clinical Trial Eligibility Estimator,https://rtools.mayo.edu/dlbcl_trial_eligibility/,An app that shows clinical trial eligibility for Diffuse Large B-cell Lymphoma patients.,rtools.mayo.edu_dlbcl_trial_eligibility_.png,,pharma,"cancer, large B-cell lymphoma, clinical trial"
Mayo Clinic ,Follicular Lymphoma Early Event Risk Calculator,https://rtools.mayo.edu/flipi24_calculator/,FLIPI24 follicular lymphoma early event risk calculator.,rtools.mayo.edu_flipi24_calculator_.png,,medicine,"cancer, follicular lymphoma, risk calculator"
Mayo Clinic ,Mortality and Morbidity Prediction,https://rtools.mayo.edu/Mayo_PCI_Risk_Score/,An app that calculates risk of various comorbidities given input data,rtools.mayo.edu_Mayo_PCI_Risk_Score_.png,2,medicine,"risk calculator, cancer, comorbitity"
Mayo Clinic ,Metastatic Breast Cancer Prognostic Calculator,https://rtools.mayo.edu/mbcProg/,This tool provides an estimated survivability percentage for those with metastatic breast cancer based on several different inputs.,rtools.mayo.edu_mbcProg_.png,,medicine,"cancer, breast cancer, calculator, survival"
Mayo Clinic ,PRESTO App,https://rtools.mayo.edu/PRESTO_calculator/,An app that calculates the PRESTO score for risk of liver decomposition in patients with PSC.,rtools.mayo.edu_PRESTO_calculator_.png,,medicine,score calculator
Mayo Clinic ,Triple Negative Breast Cancer Prognostic Calculator,https://rtools.mayo.edu/tnbcProg/,An app that calculates triple negative breast cancer prognosis with given input data.,rtools.mayo.edu_tnbcProg_.png,,medicine,"cancer, breast cancer, calculator, survival"
Georgia Institute of Technology,COVID-19 Event Risk Tool,https://covid19risk.biosci.gatech.edu/,"An app that shows the risk level of attending an event, given the event size and location.",covid19risk.biosci.gatech.edu_.png,3,public health,"map, state, county, covid-19, risk"
Harvard Medical School,Small Molecule Selectivity App,https://lsp.connect.hms.harvard.edu/smallmoleculesuite/?_inputs_&tab=%22selectivity%22,This app shows the affinity and selectivity of compounds for a protein of interest.,lsp.connect.hms.harvard.edu_smallmoleculesuite___inputs_&tab=selectivity.png,6,informatics,"small molecule,  polypharmacology"
Harvard Medical School,Small Molecule Similiarity App,https://lsp.connect.hms.harvard.edu/smallmoleculesuite/?_inputs_&tab=%22similarity%22,This app shows the similarity of compounds to a reference probe or drug.,lsp.connect.hms.harvard.edu_smallmoleculesuite___inputs_&tab=similarity.png,,informatics,"compound similarity, polypharmacology"
Harvard Medical School,Small Molecule Library App,https://lsp.connect.hms.harvard.edu/smallmoleculesuite/?_inputs_&tab=%22library%22,An app that composes custom chemical genetic libraries for gene-sets of interest.,lsp.connect.hms.harvard.edu_smallmoleculesuite___inputs_&tab=library.png,,informatics,"small molecule,  polypharmacology"
FDA,GANo: Genotype Tracker,https://dnahive.fda.gov/vmap/norovirus/genotype/,This app provides curated and comprehensive databases for visualization and analysis of norovirus genetic and antigenic diversification.,dnahive.fda.gov_vmap_norovirus_genotype_.png,,informatics,"genotype, map, norovirus"
FDA,GANo: GII.4 Epitope Tracker,https://dnahive.fda.gov/vmap/norovirus/epitope/,This app provides curated and comprehensive databases for visualization and analysis of norovirus genetic and antigenic diversification.,dnahive.fda.gov_vmap_norovirus_epitope_.png,5,informatics,"epitope, map, norovirus"
Pharmalex Cencora,Back-PredicteR,https://shinyapps.smartphlex.com/!backpredicter/,"This app helps you to back-predict signals (response) to concentrations (results) when the relation between the response and the result is known.
This is particularly useful in laboratories when determining the concentration of unknown samples through assays such as absorbance or fluorescence measurements.",shinyapps.smartphlex.com_backpredicter.png,,pharma,"assay, calibration"
Pharmalex Cencora,Two Sample Trial Designer,https://shinyapps.smartphlex.com/!ss2binom/,"This app enables you to specify your prior feelings about the effectiveness of two competing treatments (standard and novel), and subsequently find the sample size you would need to test whether the two are significantly different.",shinyapps.smartphlex.com_ss2binom.png,,pharma,"clinical trial, bayesian, sample size"
